{
  "$schema": "http://json-schema.org/draft-07/schema#",
  "type": "object",
  "properties": {
    "title": {
      "$ref": "#/definitions/localisedText"
    },
    "category": {
      "type": "string",
      "enum": [
        "essentials",
        "refereeing",
        "rules",
        "competition-day"
      ]
    },
    "summary": {
      "$ref": "#/definitions/localisedText"
    },
    "videos": {
      "default": [],
      "type": "array",
      "items": {
        "$ref": "#/definitions/video"
      }
    },
    "source": {
      "anyOf": [
        {
          "$ref": "#/definitions/ruleCitation"
        },
        {
          "type": "null"
        }
      ]
    },
    "sections": {
      "minItems": 1,
      "type": "array",
      "items": {
        "type": "object",
        "properties": {
          "heading": {
            "allOf": [
              {
                "$ref": "#/definitions/localisedText"
              }
            ]
          },
          "prose": {
            "allOf": [
              {
                "$ref": "#/definitions/localisedText"
              }
            ]
          },
          "steps": {
            "allOf": [
              {
                "$ref": "#/definitions/localisedSteps"
              }
            ]
          },
          "checklist": {
            "minItems": 1,
            "type": "array",
            "items": {
              "$ref": "#/definitions/checklistItem"
            }
          }
        }
      }
    }
  },
  "required": [
    "title",
    "category",
    "summary",
    "sections"
  ],
  "definitions": {
    "localisedText": {
      "type": "object",
      "properties": {
        "en": {
          "type": "string",
          "minLength": 1
        }
      },
      "required": [
        "en"
      ],
      "additionalProperties": {
        "type": "string",
        "minLength": 1
      },
      "description": "Text by BCP 47 language code; \"en\" required, other languages optional."
    },
    "video": {
      "type": "object",
      "properties": {
        "provider": {
          "type": "string",
          "pattern": "^[a-z0-9][a-z0-9-]*$"
        },
        "platform": {
          "type": "string",
          "enum": [
            "youtube",
            "vimeo"
          ]
        },
        "id": {
          "type": "string",
          "minLength": 1
        },
        "start": {
          "type": "integer",
          "minimum": 0,
          "maximum": 9007199254740991
        },
        "title": {
          "type": "string",
          "minLength": 1
        },
        "note": {
          "allOf": [
            {
              "$ref": "#/definitions/localisedText"
            }
          ]
        },
        "duration": {
          "type": "string",
          "minLength": 1
        },
        "role": {
          "type": "string",
          "minLength": 1
        },
        "recommended": {
          "default": false,
          "type": "boolean"
        },
        "lang": {
          "type": "string"
        },
        "captions": {
          "type": "boolean"
        },
        "spokenInstruction": {
          "type": "boolean"
        }
      },
      "required": [
        "provider",
        "platform",
        "id",
        "title"
      ]
    },
    "ruleCitation": {
      "type": "object",
      "properties": {
        "sourceId": {
          "type": "string",
          "pattern": "^[a-z0-9][a-z0-9-]*$"
        },
        "articles": {
          "minItems": 1,
          "type": "array",
          "items": {
            "type": "string",
            "minLength": 1
          }
        }
      },
      "required": [
        "sourceId",
        "articles"
      ],
      "additionalProperties": false
    },
    "localisedSteps": {
      "type": "object",
      "properties": {
        "en": {
          "minItems": 2,
          "type": "array",
          "items": {
            "type": "string",
            "minLength": 1
          }
        }
      },
      "required": [
        "en"
      ],
      "additionalProperties": {
        "minItems": 2,
        "type": "array",
        "items": {
          "type": "string",
          "minLength": 1
        }
      },
      "description": "Ordered movement steps per language (at least two); \"en\" required."
    },
    "checklistItem": {
      "type": "object",
      "properties": {
        "text": {
          "$ref": "#/definitions/localisedText"
        },
        "techniques": {
          "default": [],
          "type": "array",
          "items": {
            "type": "string",
            "minLength": 1
          }
        },
        "terms": {
          "default": [],
          "type": "array",
          "items": {
            "type": "string",
            "minLength": 1
          }
        },
        "guides": {
          "default": [],
          "type": "array",
          "items": {
            "type": "string",
            "minLength": 1
          }
        },
        "source": {
          "allOf": [
            {
              "$ref": "#/definitions/ruleCitation"
            }
          ]
        }
      },
      "required": [
        "text"
      ],
      "additionalProperties": false
    }
  },
  "title": "guide",
  "description": "One guide: essentials (belt tying, etiquette), refereeing (commands and signals), rules, or a competition-day checklist."
}
